term_localName,label,definition,usage,notes,examples,rdf_type,tdwgutility_organizedInClass,tdwgutility_required,tdwgutility_repeatable
Address,Address,A physical postal address for an organisational unit or person.,,,,http://www.w3.org/2000/01/rdf-schema#Class,http://rs.tdwg.org/dwc/terms/attributes/Address,No,Yes
LatimerCoreScheme,Latimer Core Scheme,"A grouping of multiple ObjectGroups for a particular use case, purpose or implementation.",,"Where the same objects within the same collection might be described by more than one ObjectGroup for different purposes (for examples, a 'Darwin Fossil Mammals' collection description might overlap with a 'Offsite Palaeontology' collection description), this class can be used to distinguish between them and avoid double-counting of metrics in queries against the data.",,http://www.w3.org/2000/01/rdf-schema#Class,http://rs.tdwg.org/dwc/terms/attributes/LatimerCoreScheme,Yes,Yes
CollectionStatusHistory,Collection Status History,A record of current and past statuses of the object group and the reason for status changes.,,"Use this class to record the history of and reason for changes in the status of the described collection. Types of status described by this class may, for example, include ownership, management, accessibility or accrual policy over time. Dates reflecting the start and end of the status described by this class should be recorded using an instance of TemporalCoverage. If temporalCoverageEndDate is empty, the status can be inferred to be the current status of the collection.",,http://www.w3.org/2000/01/rdf-schema#Class,http://rs.tdwg.org/dwc/terms/attributes/CollectionStatusHistory,No,Yes
ContactDetail,Contact Detail,Details of a method by which an entity such as a Person or OrganisationalUnit may be contacted.,,"The Address class should be used to store physical or postal addresses. For all other types of contact details, this class should be used.",,http://www.w3.org/2000/01/rdf-schema#Class,http://rs.tdwg.org/dwc/terms/attributes/ContactDetail,No,Yes
Event,Event,An action that occurs at some location during some time.,,Derived from dwc Class event (http://rs.tdwg.org/dwc/terms/version/Event-2018-09-06). This class has been defined under the ltc namespace because it only has a subset of the properties of DwC:Event. All ltc:Event properties are borrowed from and reference the dwc namespace. Examples of an Event include: A specimen collection process. A camera trap image capture. A marine trawl.,,http://www.w3.org/2000/01/rdf-schema#Class,http://rs.tdwg.org/dwc/terms/attributes/Event,No,Yes
GeographicOrigin,Geographic Origin,The geographic location from which objects associated with the ObjectGroup were collected.,,,,http://www.w3.org/2000/01/rdf-schema#Class,http://rs.tdwg.org/dwc/terms/attributes/GeographicOrigin,No,Yes
Identifier,Identifier,"A numeric, textual value, or reference such as an IRI, that can be used to uniquely identify the object to which it is attached.",,"Use this class to document stable identifiers that describe the collections and associated entities being represented in the collection description. For example, person identifiers, taxon identifiers, institution identifiers, organisational unit identifiers, gazetteer identifiers. Identifiers represented by this class may be globally unique, or unique within a given context.",,http://www.w3.org/2000/01/rdf-schema#Class,http://rs.tdwg.org/dwc/terms/attributes/Identifier,No,Yes
ObjectClassification,Object Classification,"An informal classification of the type of objects within the ObjectGroup, using a hierarchical structure.",,"This class is used to categorise the ObjectGroup according to an informal, self-referential hierarchy. For example, this can be used to create a hierarchy encompassing biological, geological and anthropological collections, where a single formal taxonomy isn't appropriate.",,http://www.w3.org/2000/01/rdf-schema#Class,http://rs.tdwg.org/dwc/terms/attributes/ObjectClassification,No,Yes
ObjectGroup,Object Group,An intentionally grouped set of objects with one or more common characteristics.,,,,http://www.w3.org/2000/01/rdf-schema#Class,http://rs.tdwg.org/dwc/terms/attributes/ObjectGroup,Yes,Yes
OrganisationalUnit,Organisational Unit,"A unit within an organisational hierarchy which may be at, above or below the institutional level.",,"This class can represent any level of organisational unit, incorporating institutions (e.g. a museum), higher units (e.g. a university to which a museum belongs) and more detailed structures (e.g the departments and divisions within a museum). It can be used to arrange these different units at different levels into a hierarchical structure. This class combines aspects of both class org:Organization (https://www.w3.org/TR/2014/REC-vocab-org-20140116/#org:Organization) and class org:OrganizationalUnit (https://www.w3.org/TR/2014/REC-vocab-org-20140116/#org:OrganizationalUnit) from the W3C Organization Ontology ORG (https://www.w3.org/TR/2014/REC-vocab-org-20140116/#overview-of-ontology). Recommended best practice is to associate a unique, persistent organisational identifier (PID) with each created organisational unit. This will allow an unambiguous and continual identification of the unit, as well as the creation of organisational hierarchies. Existing providers of PIDs for organisations are, e.g. https://grid.ac/ and https://ror.org/. The provision of organisational PIDs might be extended to intra-organisational units in the future. Properties of Class: Identifier can be used to add identifier information for organisational units.",,http://www.w3.org/2000/01/rdf-schema#Class,http://rs.tdwg.org/dwc/terms/attributes/OrganisationalUnit,No,Yes
Person,Person,"A person (alive, dead, undead, or fictional).",A person (alive or dead).,"This concept should map to the Schema.org Person class (https://schema.org/Person), and the prov:Person class (http://www.w3.org/ns/prov#Person) in the PROV ontology. In the latter, it is a subclass of prov:Agent, which through which it can map to the RDA recommendations on attribution (http://dx.doi.org/10.15497/RDA00029). The definition is appropriated from the Schema.org class.",,http://www.w3.org/2000/01/rdf-schema#Class,http://rs.tdwg.org/dwc/terms/attributes/Person,No,Yes
PersonRole,Person Role,A qualified association between a Person or OrganisationalUnit and an entity such as an ObjectGroup or MeasurementOrFact that enables the relationship to be contextualised with a specific role and time period.,,"This class is aligned with the prov:qualifiedAttribution property (http://www.w3.org/ns/prov#qualifiedAttribution). It should be used instead of the Activity and PersonActivity classes to link a Person or OrganisationalUnit to an entity in situations where an activity is not know or is irrelevant, for example for describing a person's role within an organisation.",,http://www.w3.org/2000/01/rdf-schema#Class,http://rs.tdwg.org/dwc/terms/attributes/PersonRole,No,Yes
RecordLevel,Record Level,The machine-actionable information profile for the collection description digital object.,,Linked to the RDA PID Kernel recommendation (https://www.rd-alliance.org/system/files/RDA%20Recommendation%20on%20PID%20Kernel%20Information_final.pdf),,http://www.w3.org/2000/01/rdf-schema#Class,http://rs.tdwg.org/dwc/terms/attributes/RecordLevel,Yes,Yes
SchemeMeasurementOrFact,Scheme Measurement Or Fact,"A type of measurement or fact used by the LatimerCoreScheme, and the rules relating to its application.",,"This class can be used to specify the qualitative and quantitative metrics that will be included in the LatimerCoreScheme using the MeasurementOrFact class, and dictate whether each will be mandatory and/or repeatable. This information can be used by software and queries to constrain and validate the Latimer Core dataset, and determine how and whether metrics can be aggregated and reported. The schemeMeasurementType property should correspond to the measurementType property of the MeasurementOrFact class in order to make the relevant association between the scheme definition and the stored data.",,http://www.w3.org/2000/01/rdf-schema#Class,http://rs.tdwg.org/dwc/terms/attributes/SchemeMeasurementOrFact,No,Yes
SchemeTerm,Scheme Term,A Latimer Core term used by the LatimerCoreScheme and the rules relating to its application.,,"This class can be used to define which of the terms (classes and/or properties) within the standard (e.g. GeographicOrigin, Taxon, preservationMethod) are expected to be used within the scheme, and specify whether they're mandatory and/or repeatable. This information can be used by software and queries to validate the data and understand the rules by which metrics can be reported against the specified term.",,http://www.w3.org/2000/01/rdf-schema#Class,http://rs.tdwg.org/dwc/terms/attributes/SchemeTerm,No,Yes
StorageLocation,Storage Location,"A physical location (such as a building, room, cabinet or drawer) within the holding institution where objects associated with the collection description are stored or exhibited.",,,,http://www.w3.org/2000/01/rdf-schema#Class,http://rs.tdwg.org/dwc/terms/attributes/StorageLocation,No,Yes
TemporalCoverage,Temporal Coverage,A record of a time range represented by the collection's establishment or change over time. This term is separate from the living or geologic periods represented by the objects in the collection.,,"This class can be used to reflect temporal coverage of the collection within various contexts (defined by the temporalCoverageType property). Examples might include the time range in which objects within the collection were collected or the time period over which the collection was assembled.  It should not be used to document the time range within which the objects in the collection were alive, and if the time period you are trying to describe is better described by the `CollectionHistory`, `GeologicalContext` or `ChronometricAge` classes, or period property of the `ObjectGroup` class, then those classes or properties should be used instead. For example, the period property of the `ObjectGroup` class and/or `GeologicalContext` class should be used to record named time periods. `TemporalCoverage` is a repeatable class, but when present as a property of `Event` or `CollectionStatusHistory`, multiple occurences should be avoided and repeated occurences of the parent class should be used instead.",,http://www.w3.org/2000/01/rdf-schema#Class,http://rs.tdwg.org/dwc/terms/attributes/TemporalCoverage,No,Yes
basisOfScheme,Basis Of Scheme,A summary of the basis or purpose for the LatimerCoreScheme.,,"This property is intended to summarise the reason for grouping a number of ObjectGroups within the LatimerCoreScheme, and the purpose for which the data is intended to be used. This may also be reflected in the terms and metrics defined using the SchemeTerm and SchemeMeasurementOrFact classes respectively. Using this approach, standard and reusable profiles within the wider Latimer Core standard may be constructed for common collection descriptions use cases.","`Accession`, `Inventory`, `Expedition`, `Digitisation planning`, `Collections assessment`, `Institution`, `Collections registry`",http://www.w3.org/1999/02/22-rdf-syntax-ns#Property,http://rs.tdwg.org/dwc/terms/attributes/LatimerCoreScheme,No,No
distinctObjects,Distinct Objects,A flag to designate whether a physical object may be described by more than one ObjectGroup within the LatimerCoreScheme.,"If distinctObjects is set to 'true', then no collection object should be covered by more than one object group within the LatimerCoreScheme.","If distinctObjects is set to 'true', then no collection object should be covered by more than one object group within the LatimerCoreScheme. This is important for aggregating and reporting on metrics such as object counts, as it prevents any physical object from being counted more than once.",`true` `false`,http://www.w3.org/1999/02/22-rdf-syntax-ns#Property,http://rs.tdwg.org/dwc/terms/attributes/LatimerCoreScheme,Yes,No
schemeName,Scheme Name,A short descriptive name given to the LatimerCoreScheme.,,,"`NHM Collections Inventory`, `Index Herbariorum`, `European Darwin Collections`",http://www.w3.org/1999/02/22-rdf-syntax-ns#Property,http://rs.tdwg.org/dwc/terms/attributes/LatimerCoreScheme,Yes,No
status,Status,The development status of the collection during a specified period.,,The values/vocabularies for a status are predicated by the statusType. The in the examples mentioned terms are a cumulative list of terms associated with several different statusTypes.,"`Complete`, `In part`, `Developing`, `Closed`, `Active growth`, `Consumable`, `Decreasing`, `Lost`, `Missing`, `Passive growth`, `Static`",http://www.w3.org/1999/02/22-rdf-syntax-ns#Property,http://rs.tdwg.org/dwc/terms/attributes/CollectionStatusHistory,Yes,No
statusChangeReason,Status Change Reason,An explanation of why the collection transitioned to the value set in the status property.,,statusChangeReason should be aligned with the value of statusType.,"`Pest infestation`, `Exchange`, `Transfer`, `Return to country of origin`, `Worldwide pandemic`",http://www.w3.org/1999/02/22-rdf-syntax-ns#Property,http://rs.tdwg.org/dwc/terms/attributes/CollectionStatusHistory,No,No
statusType,Status Type,A top-level classification of the different categories of status that can be applied to the collection.,,statusType forms the top level of a two-level hierarchy with the status property.,"`Stewardship`, `Accessibility`, `Completeness`, `Collection dynamics`, `Organisational`",http://www.w3.org/1999/02/22-rdf-syntax-ns#Property,http://rs.tdwg.org/dwc/terms/attributes/CollectionStatusHistory,Yes,No
contactDetailCategory,Contact Detail Category,The method of contact to which the contact detail applies.,,Recommended practice is to use a controlled vocabulary.,"`Email`, `Phone`, `Twitter handle`, `GitHub handle`",http://www.w3.org/1999/02/22-rdf-syntax-ns#Property,http://rs.tdwg.org/dwc/terms/attributes/ContactDetail,Yes,No
contactDetailType,Contact Detail Type,"The type of contact detail, which can be used to distinguish between multiple contact details of the same contactDetailCategory.",,,"`Home`, `Personal`, `Work`, `General enquiries`",http://www.w3.org/1999/02/22-rdf-syntax-ns#Property,http://rs.tdwg.org/dwc/terms/attributes/ContactDetail,No,No
contactDetailValue,Contact Detail Value,"The value of the contact detail, such as the phone number or email address.",,,"`01234 567891`, `someone@example.org`, `@github_user`",http://www.w3.org/1999/02/22-rdf-syntax-ns#Property,http://rs.tdwg.org/dwc/terms/attributes/ContactDetail,Yes,No
region,Region,The name of a spatial region or named place of any size within an individual or multiple administrative areas.,The name of the spatial region or named place of any size within an individual or multiple administrative areas from which objects in the collection originated.,"Recommended best practice is to use this field in situations where the administrative location fields (country, stateProvince, county, etc.) provide insufficient description. For geological collections examples include basins, provinces, and fossil deposits.","Multi-country: `North European Plain`, Multi-state/Province: `Pacific Northwest`, Waterbody: `Southern`, Geological basins and provinces: `Michigan Basin`, `Mazon Creek`, `Bundenbach`",http://www.w3.org/1999/02/22-rdf-syntax-ns#Property,http://rs.tdwg.org/dwc/terms/attributes/GeographicOrigin,No,No
salinityType,Salinity Type,A set of terms to indicate the water environment of aquatic collections.,,"This should not be construed as a measurement value, but as a descriptive terms to allow for searching for freshwater vs marine etc. collections.","`marine`, `fresh`, `brackish`",http://www.w3.org/1999/02/22-rdf-syntax-ns#Property,http://rs.tdwg.org/dwc/terms/attributes/GeographicOrigin,No,No
waterBodyType,Waterbody Type,A term that indicates the aquatic order of a waterbody.,,https://www.usgs.gov/mission-areas/water-resources/science/types-water  https://sciencetrends.com/types-bodies-water-complete-list/,"`Ocean`, `Sea`, `Lake`, `Pond`, `River`",http://www.w3.org/1999/02/22-rdf-syntax-ns#Property,http://rs.tdwg.org/dwc/terms/attributes/GeographicOrigin,No,No
identifierType,Identifier Type,The type and format of the value in the identifier field.,,This property should be used to help people and software understand how the identifier can be used (e.g. whether it's a resolvable URI) and validate the identifier based on format and composition (e.g. a valid UUID).,"`Acronym`, `URI`, `UUID v4`",http://www.w3.org/1999/02/22-rdf-syntax-ns#Property,http://rs.tdwg.org/dwc/terms/attributes/Identifier,Yes,No
measurementDerivation,Measurement Derivation,"An indicator as to whether the measurement, fact, characteristic, or assertion being applied to the collection was derived from reported figures or aggregated/calculated from underlying data.",,"If there is more detailed information about the method by which a measurement or fact was derived, this should be captured using the measurementMethod property.","`Reported`, `Calculated`",http://www.w3.org/1999/02/22-rdf-syntax-ns#Property,http://rs.tdwg.org/dwc/terms/attributes/MeasurementOrFact,No,No
measurementFactText,Fact or Narrative Text,"The value of the qualitative fact, characteristic, or assertion being made about the collection.",,"This property should also be used for storing textual information about the collection within a particular context, such as narratives or comments about digitisation readiness.","`UV-light`, `Extra large`, `Level 1`, `Re-curation of this collection would be required prior to digitisation, requiring an estimated two weeks of curator time.`",http://www.w3.org/1999/02/22-rdf-syntax-ns#Property,http://rs.tdwg.org/dwc/terms/attributes/MeasurementOrFact,No,No
objectClassificationLevel,Object Classification Level,The level of the ObjectClassification in the hierarchy.,,It is up to the user to name the levels to be relevant to the hierarchical classification scheme that they are defining.,"`Domain`, `Discipline`, `Category`",http://www.w3.org/1999/02/22-rdf-syntax-ns#Property,http://rs.tdwg.org/dwc/terms/attributes/ObjectClassification,No,No
objectClassificationName,Object Classification Name,"A short title describing this ObjectClassification as a class, unit or grouping.",,"This is a user-determined name given for classifying their collection. This name, expressing an assigned classification, can be part of a self-referential hierarchy.","`Zoology invertebrates`, `Palaeontology`, `Extra-terrestrial`, `Archaeology`, `Seed plants`, `Birds`, `Agriculture`, `Veterinary`, `Viruses`",http://www.w3.org/1999/02/22-rdf-syntax-ns#Property,http://rs.tdwg.org/dwc/terms/attributes/ObjectClassification,Yes,No
objectClassificationParent,Object Classification Parent,The immediate parent of the ObjectClassification in a self-referential hierarchy.,,,The ObjectClassification `Zoology` is the parent of the `Invertebrates` ObjectClassification; the ObjectClassification `Extraterrestrial` is the parent of the `Meteorites` ObjectClassification.,http://www.w3.org/1999/02/22-rdf-syntax-ns#Property,http://rs.tdwg.org/dwc/terms/attributes/ObjectClassification,No,No
baseTypeOfObjectGroup,Base Type Of Object Group,High-level term describing the fundamental nature of objects in the ObjectGroup.,,"For natural history collections baseTypeOfObjectGroup describes types of occurrences and may constrain the values available in objectType. Notes for ObjectGroups where baseTypeOfObjectGroup is 'InformationArtefact': subsequent ‘type’ properties could include hierarchical Audiovisual Core/Dublin Core terms – e.g. dc:type (http://purl.org/dc/elements/1.1/type), ac:subtype / ac:subtypeLiteral (http://rs.tdwg.org/ac/terms/subtypeLiteral), or (proposed) ac:3DResourceType.","`MaterialSample`, `InformationArtefact`",http://www.w3.org/1999/02/22-rdf-syntax-ns#Property,http://rs.tdwg.org/dwc/terms/attributes/ObjectGroup,Yes,No
collectionManagementSystem,Collection Management System,The collection management system which is used to hold and manage the primary data for the objects contained within the ObjectGroup.,,"This should reflect the system or database in which the object-level records reside, rather than the source of the Collection Description data.","`Specify 7`, `DINA`, `Axiell EMu`, `Arctos`, `EarthCape`, `BRAHMS`",http://www.w3.org/1999/02/22-rdf-syntax-ns#Property,http://rs.tdwg.org/dwc/terms/attributes/ObjectGroup,No,Yes
collectionName,Collection Name,A short title that summarises the collection objects contained within the ObjectGroup.,,,"`The Leslie Hubricht Molluscan Collection`, `NHM Algae, Fungi and Plants collection`, `Crustacea – Cirripedes, Decapoda`, `Global Mesozoic and Paleozoic mollusc faunas/samples`",http://www.w3.org/1999/02/22-rdf-syntax-ns#Property,http://rs.tdwg.org/dwc/terms/attributes/ObjectGroup,Yes,No
conditionsOfAccess,Conditions of Access,Information about who can access the collection being described or an indication of its security status.,,"If available, this should be a URL to a stable policy page. For example, https://www.fieldmuseum.org/science/research/area/fossils-meteorites/fossils-meteorites-policies.",`Open to the public`,http://www.w3.org/1999/02/22-rdf-syntax-ns#Property,http://rs.tdwg.org/dwc/terms/attributes/ObjectGroup,No,Yes
currentCollection,Current Collection,A flag to indicate whether the collection still exists as a single entity.,,Use this to indicate if the record describes the entirety of a known historical collection. If only part of the collection is present the value is 'false'.,`true` `false` `unknown`,http://www.w3.org/1999/02/22-rdf-syntax-ns#Property,http://rs.tdwg.org/dwc/terms/attributes/ObjectGroup,No,No
discipline,Discipline,A high level classification of the scientific discipline to which the objects within the collection belong or are related.,,"The recommendation is to use a controlled vocabulary that is also common across other community collections, object and occurrence standards. Suggested list https://confluence.egi.eu/display/EGIG/Scientific+Disciplines","`Anthropology`, `Botany`, `Extraterrestrial`, `Geology`, `Microorganisms`, `Other geo/biodiversity`, `Palaeontology`, `Virology`, `Zoology invertebrates`, `Zoology vertebrates`, `Unspecified`",http://www.w3.org/1999/02/22-rdf-syntax-ns#Property,http://rs.tdwg.org/dwc/terms/attributes/ObjectGroup,No,Yes
knownToContainTypes,Known To Contain Types,Flag property to indicate that the collection is known to include type specimens.,,`yes` - this collection contains types; `no` - this collections does not contain types; `unknown` - this collection has not been checked for types or the type concept is irrelevant for this discipline,`yes` `no` `unknown`,http://www.w3.org/1999/02/22-rdf-syntax-ns#Property,http://rs.tdwg.org/dwc/terms/attributes/ObjectGroup,No,No
material,Material,"Material denotes the raw substance(s) from which the object is formed, in whole or in part.",,This definition maps roughly to the concept of E57 'material' from the CIDOC CRM: https://cidoc-crm.org/Entity/E57-Material/version-7.1.1,"The object, or artefact could contain biological parts, for example jewellery made of amber with insects in, or cloaks made of bird feathers. It should not be used for taxonomic identifications. Examples include terms such as `brick`, `gold`, `aluminium`, `polycarbonate`, `resin`, `amber`, `feather`",http://www.w3.org/1999/02/22-rdf-syntax-ns#Property,http://rs.tdwg.org/dwc/terms/attributes/ObjectGroup,No,Yes
objectType,Object Type,High-level terms for the classification of curated objects.,A more generic classification of items in the collection than described in preparationType.,"This should not be used for classifying objects by taxon. The best way to do that is to use the Taxon class (formal taxonomy and vernacular names) or ObjectClassification class (informal classification). For cultural collections terms such as 'bowl', 'textile' are appropriate at this level. For large collections of multiple types use pipe delimited lists.","`tissue`, `specimen`, `culture`, `rna`, `mineral`, `dna`, `environmental sample`, `HTS Library`",http://www.w3.org/1999/02/22-rdf-syntax-ns#Property,http://rs.tdwg.org/dwc/terms/attributes/ObjectGroup,No,Yes
period,Period,Used to describe prehistoric or historic periods.,Used to describe the prehistoric or historic period  from which objects in the collection originated.,"Often used to describe prehistoric or historic periods, but also geopolitical units and activities of settlements are regarded as special cases of Period. However, there are no assumptions about the scale of the associated phenomena. In particular all events are seen as synthetic processes consisting of coherent phenomena. This property maps to the Period class of the CIDOC-CRM conceptual reference model (http://www.cidoc-crm.org/Entity/e4-period/version-7.1.1).","`Neolithic Period`, `Ming Dynasty`, `McCarthy Era`",http://www.w3.org/1999/02/22-rdf-syntax-ns#Property,http://rs.tdwg.org/dwc/terms/attributes/ObjectGroup,No,Yes
