term_localName,label,definition,usage,notes,examples,rdf_type,tdwgutility_organizedInClass,tdwgutility_required,tdwgutility_repeatable
preparationType,Preparation Type,A term used to classify or describe an object that indicates the actions that have been taken upon it and/or the processes it has been put through to prepare it for scientific use or study.,A more specific classification of items in the collection than described in objectType.,"This can be the same as PreservationMethod (e.g. Bone), but is not always. This should not be used for classifying objects by taxon. The best way to do that is to use the Taxon class (formal taxonomy and vernacular names) or ObjectClassification class (informal classification). For large collections with multiple types use a pipe delimited list.","`Bones`, `Eggs`, `Fossils`, `Gemstones`, `Lysate`, `Macrofossils`, `eDNA`, `Viable cells`, `Pollen`, `Muscle`, `Leaf`, `Blood`, `Known - witheld`",http://www.w3.org/1999/02/22-rdf-syntax-ns#Property,http://rs.tdwg.org/dwc/terms/attributes/ObjectGroup,No,Yes
preservationMethod,Preservation Method,"A term used to classify or describe an object that indicates the primary or most recent action, measure or process that has been used in order to preserve the objects in the collection for long-term storage.",For the purposes of a collection description preservationType should be used to describe the larger collection,"Not intended to be used as the fossilization method. Use preservationMode for that. This field is intended to be use where a collection has a single or prominent preservationMethod. If the collection has multiple preservationMethods then this should be expressed elsewhere, such as in ObjectQuantity. We recommend the Arctos PART_PRESERVATION vocabulary (https://arctos.database.museum/info/ctDocumentation.cfm?table=CTPART_PRESERVATION). For herbarium sheets use 'dried_pressed'. If an alcohol collection uses mixed percentages use 'alcohol'.","`fluid_preserved`, `alcohol`, `formaldehyde`, `dried`, `dried_pinned`, `dried_pressed`, `mounted`, `microscope_slide`, `glycerin`, `gum_arabic`, `frozen`, `refrigerated`, `freeze_dried`, `mixed`, `no_treatment`, `known:withheld`, `unknown`, `papered/packaged`",http://www.w3.org/1999/02/22-rdf-syntax-ns#Property,http://rs.tdwg.org/dwc/terms/attributes/ObjectGroup,No,Yes
preservationMode,Preservation Mode,"The means by which a palaeontological specimen was preserved or created e.g. body, cast, mold, trace fossil, soft parts mineralised etc.",Use to describe the preservation mode of a collection as a whole. (e.g. Amber collection),This property is aligned with the concept of preservationMode (https://efg.geocase.eu/documentation/html/efg.html#element_PreservationMode_Link03032878) in ABCD(EFG).,"`adpression/compression`, `body`, `cast`, `charcoalification`, `coalified`, `concretion`, `dissolution traces`, `mold/impression`, `permineralised`, `recrystallised`, `soft parts`, `trace`",http://www.w3.org/1999/02/22-rdf-syntax-ns#Property,http://rs.tdwg.org/dwc/terms/attributes/ObjectGroup,No,Yes
typeOfObjectGroup,Type Of Object Group,Additional information that exists that describes the object(s) in the collection.,,"Terms such as soil, pollen, faeces, muscle, genomic DNA are currently put in preparationType. These terms have been parked for discussion: HumanObservations, MachineObservations.","`PreservedSpecimens`, `FossilSpecimens`, `MineralSpecimens`, `ArchaeologicalArtefacts`, `EthnographicObjects`, `HumanRemains`, `HominidRemains`, `MaterialSamples`, `LivingSpecimens`",http://www.w3.org/1999/02/22-rdf-syntax-ns#Property,http://rs.tdwg.org/dwc/terms/attributes/ObjectGroup,No,Yes
organisationalUnitName,Organisational Unit Name,An official name of the organisational unit in the local language.,,"Repeatable where there are more than one official local language required for example Belgian Institutions where an official name exists in French, Dutch, German and English. See 'A Collection of Crosswalks from Fifteen Research Data Schemas to Schema.org' (https://www.rd-alliance.org/group/research-metadata-schemas-wg/outcomes/collection-crosswalks-fifteen-research-data-schemas) from RDA for crosswalks for properties with the function of Name, Title, etc. Take into account the note at the class level (Class:OrganisationalUnit) about associating an identifier in addition to a name with the organisational unit.","`Muséum national d'Histoire naturelle`, `The Field Museum of Natural History`, `Division of Fishes`",http://www.w3.org/1999/02/22-rdf-syntax-ns#Property,http://rs.tdwg.org/dwc/terms/attributes/OrganisationalUnit,Yes,No
organisationalUnitType,Organisational Unit Type,The type or level of organisational unit within a hierarchy responsible for the management of the collection being described.,,Example vocabulary list: https://vocab.org/aiiso/ . This property is likely related to the W3C class org:Role (https://www.w3.org/TR/2014/REC-vocab-org-20140116/#class-role).,"`Department` (A group of people recognised by an organization as forming a cohesive group referred to by the organization as a department), `Division` (A group of people recognised by an organization as forming a cohesive group referred to by the organization as a division)",http://www.w3.org/1999/02/22-rdf-syntax-ns#Property,http://rs.tdwg.org/dwc/terms/attributes/OrganisationalUnit,Yes,No
endedAtTime,Ended At Time,The date or time when a Person stopped fulfilling the role specified in the role property.,,This property maps to the PROV-O term endedAtTime (http://www.w3.org/ns/prov#endedAtTime) in the Activity class (http://www.w3.org/ns/prov#Activity).,"`1886`, `1984-09`, `2001-10-22`, `1997-07-16T19:20+01:00`, `1997-07-16T19:20:30+01:00`",http://www.w3.org/1999/02/22-rdf-syntax-ns#Property,http://rs.tdwg.org/dwc/terms/attributes/PersonRole,No,No
role,Role,"A role played by a Person in the context of an entity such as an ObjectGroup, OrganisationalUnit or RecordLevel.",,This property maps to the PROV-O property hadRole (http://www.w3.org/ns/prov#hadRole).,"`Director`, `Chair`, `Record owner`, `Primary Collection Description record contact`, `Primary collection contact`, `Owner`, `Curator`, `Collection manager`, `Head of department`, `Registrar`",http://www.w3.org/1999/02/22-rdf-syntax-ns#Property,http://rs.tdwg.org/dwc/terms/attributes/PersonRole,Yes,No
startedAtTime,Started At Time,The date or time when a Person started fulfilling the role specified in the role property.,,This property maps to the PROV-O term startedAtTime (http://www.w3.org/ns/prov#startedAtTime) in the Activity class (http://www.w3.org/ns/prov#Activity).,"`1886`, `1984-09`, `2001-10-22`, `1997-07-16T19:20+01:00`, `1997-07-16T19:20:30+01:00`",http://www.w3.org/1999/02/22-rdf-syntax-ns#Property,http://rs.tdwg.org/dwc/terms/attributes/PersonRole,No,No
collectionDescriptionPID,Collection Description PID,An unambiguous reference to the collection description record.,The contents of this field must be an instance of ltc:Identifier,"Recommended practice is to identify the resource by means of a string conforming to an identification system. Examples include International Standard Book Number (ISBN), Digital Object Identifier (DOI), and Uniform Resource Name (URN). Persistent identifiers should be provided as HTTP URIs.",`10.5072/example-full`,http://www.w3.org/1999/02/22-rdf-syntax-ns#Property,http://rs.tdwg.org/dwc/terms/attributes/RecordLevel,Yes,No
derivedCollection,Derived Collection,A flag to indicate that the collection description has been generated by aggregating data from one or more underlying datasets of its individual objects.,,For example this would be set = Yes if the record is an automatically generated reconstruction of Darwin’s finch collection which is now held at multiple institutions.,"`Yes`, `No`",http://www.w3.org/1999/02/22-rdf-syntax-ns#Property,http://rs.tdwg.org/dwc/terms/attributes/RecordLevel,No,No
referenceType,Reference Type,The type of resource being referenced.,,This property is intended to be used for a high level categorisation of resource types.,"`Policy`, `Document`, `Website`, `Dataset`",http://www.w3.org/1999/02/22-rdf-syntax-ns#Property,http://rs.tdwg.org/dwc/terms/attributes/Reference,No,No
relatedResourceName,Related Resource Name,A short textual name for the related resource.,,"This property can be used to list resources related to the source entity which lack an identifier, for example if a separate record for that resource doesn't yet exist. In the Collection Description standard, a use of this is to list named subcollections of a larger collections at a time when the resources might not be available to create a full Collection Description for each of them. If at a later point a Collection Description record is created for the subcollection, an identifier can be added to the relatedResourceID property to maintain the same relationship.","`FMNH Mammals`, `TNHC Vertebrates`, `Sloane Herbarium`, `Grant Southwest Ceramics Collection`",http://www.w3.org/1999/02/22-rdf-syntax-ns#Property,http://rs.tdwg.org/dwc/terms/attributes/ResourceRelationship,No,No
mandatoryMetric,Mandatory Metric,A flag to designate whether it's mandatory or optional for every collection description within the CollectionDescriptionScheme to include the measurement or fact defined by the schemeMeasurementType property.,,This flag can be used for software automation and data validation.,"`true`, `false`, `yes`, `no`",http://www.w3.org/1999/02/22-rdf-syntax-ns#Property,http://rs.tdwg.org/dwc/terms/attributes/SchemeMeasurementOrFact,Yes,No
repeatableMetric,Repeatable Metric,A flag to designate whether multiple instances of the same schemeMeasurementType may be attached to a single entity.,,"For example, this property can be used to stipulate that, using the MeasurementOrFact class, only one 'Object count' may be attached to an ObjectGroup, but multiple 'Curator notes' may be attached to the same ObjectGroup.","`true`, `false`, `yes`, `no`",http://www.w3.org/1999/02/22-rdf-syntax-ns#Property,http://rs.tdwg.org/dwc/terms/attributes/SchemeMeasurementOrFact,Yes,No
schemeMeasurementType,Scheme Measurement Type,A category of quantitative metric or qualitative fact that can be included in the CollectionDescriptionScheme.,,"The schemeMeasurementType should correspond to, and be used to catalogue and/or constrain, the values that can be used in the measurementType property of the MeasurementOrFact class.","`Imaged Level Percentage`, `Storage Volume`, `Object Count`, `MIDS-0 Object Count`, `Historical Narrative`",http://www.w3.org/1999/02/22-rdf-syntax-ns#Property,http://rs.tdwg.org/dwc/terms/attributes/SchemeMeasurementOrFact,Yes,No
mandatoryTerm,Mandatory Term,A flag to designate whether it's mandatory or optional for all ObjectGroups in the CollectionDescriptionScheme to include or be linked to valid data for the class or property defined in the termName property.,,"This flag can be used for software automation and data validation. For example, if the termName is 'preservationMethod' (a property) and mandatoryTerm is 'yes', then an interface or query should always expect a value for that property, and can validate against that expectation. If the termName is Taxon (a class) and the mandatoryTerm is 'yes', then similarly the expectation will be that at least one populated Taxon object is linked to every ObjectGroup. If the repeatableTerm property is set to 'no', then the expectation will be that exactly one populated Taxon object is linked to every ObjectGroup and no more.","`true`, `false`, `yes`, `no`",http://www.w3.org/1999/02/22-rdf-syntax-ns#Property,http://rs.tdwg.org/dwc/terms/attributes/SchemeTerm,Yes,No
repeatableTerm,Repeatable Term,A flag to designate whether multiple instances of the Latimer Core class or property defined in the termName property may be attached to a single ObjectGroup.,,"This property essentially defines whether the property or class is used for a 'tagging' approach (e.g. attaching multiple Taxon records to the same ObjectGroup to reflect the taxonomic scope, or a 'dimensional' approach (e.g. attaching a single GeologicalContext to an ObjectGroup, to show that it represents only objects from the Mesozoic). This has implications on how metrics may be handled, and more information is available in the non-normative guidance.","`true`, `false`, `yes`, `no`",http://www.w3.org/1999/02/22-rdf-syntax-ns#Property,http://rs.tdwg.org/dwc/terms/attributes/SchemeTerm,Yes,No
termName,Term Name,The name of a class or property within the Latimer Core standard that is included in the CollectionDescriptionScheme.,,The values of this property are constrained to the names of terms (classes or properties) within the Latimer Core standard.,"`GeographicOrigin`, `Taxon`, `preservationMethod`, `discipline`",http://www.w3.org/1999/02/22-rdf-syntax-ns#Property,http://rs.tdwg.org/dwc/terms/attributes/SchemeTerm,Yes,No
locationName,Location Name,A label used to identify a place where the collection is stored.,,This is the lowest level of storage location for the object group (collection or sub-collection).,"`Building A`, `Cryptogamic herbarium`, `Cupboard C1`",http://www.w3.org/1999/02/22-rdf-syntax-ns#Property,http://rs.tdwg.org/dwc/terms/attributes/StorageLocation,Yes,No
locationType,Location Type,The nature of the location where the collection is stored.,,"This defines the type of storage location named in locationName, and may refer to static locations or moveable containers.","`Site`, `Building`, `Floor`, `Room`, `Cabinet`, `Drawer`",http://www.w3.org/1999/02/22-rdf-syntax-ns#Property,http://rs.tdwg.org/dwc/terms/attributes/StorageLocation,No,No
temporalCoverageEndDate,Temporal Coverage End Date,End date of the time range of the collection.,"If there is a temporalCoverageStartDate value and the action being documented is ongoing temporalCoverageEndDate should remain NULL, otherwise temporalCoverageEndDate = temporalCoverageStartDate.  If there is a temporalCoverageEndDate value, temporalCoverageType is strongly recommended.",,"`1886`, `1984-09`, `2001-10-22`",http://www.w3.org/1999/02/22-rdf-syntax-ns#Property,http://rs.tdwg.org/dwc/terms/attributes/TemporalCoverage,No,No
temporalCoverageStartDate,Temporal Coverage Start Date,Start date of the time range of the collection.,"If there is a temporalCoverageStartDate value, temporalCoverageType is recommended.",,"`1886`, `1984-09`, `2001-10-22`",http://www.w3.org/1999/02/22-rdf-syntax-ns#Property,http://rs.tdwg.org/dwc/terms/attributes/TemporalCoverage,No,No
temporalCoverageType,Temporal Coverage Type,The type or context of the time range associated with the collection's establishment. Separate from the living or geologic periods represented by the objects in the collection.,"If there is a value for temporalCoverageStartDate or temporalCoverageEndDate, temporalCoverageType is recommended.",Recommendation is to use a controlled vocabulary.,`Collecting time range` `Establishment time range`,http://www.w3.org/1999/02/22-rdf-syntax-ns#Property,http://rs.tdwg.org/dwc/terms/attributes/TemporalCoverage,No,No
